{
  "id": "lentil_dal",
  "title": "Lentil Dal",
  "author": "Claude",
  "servings": 4,
  "image": "images/lentil_dal.svg",
  "description": "Creamy spiced red lentils simmered with tomato and coconut milk. Cosy and cheap.",
  "cuisine": "Indian",
  "tags": ["dinner", "vegetarian", "comfort"],
  "prep_time": 10,
  "cook_time": 30,
  "ingredients": [
    { "ingredient": "lentils", "amount": 300 },
    { "ingredient": "onion", "amount": 1, "unit": "pcs", "note": "finely chopped" },
    { "ingredient": "garlic", "amount": 3, "unit": "cloves" },
    { "ingredient": "tomato", "amount": 200 },
    { "ingredient": "coconut_milk", "amount": 0.5, "unit": "can" },
    { "ingredient": "curry_powder", "amount": 10 },
    { "ingredient": "olive_oil", "amount": 1, "unit": "tbsp" },
    { "ingredient": "rice", "amount": 240 },
    { "ingredient": "salt" }
  ],
  "steps": [
    "Soften the onion and garlic in olive oil, then stir in the curry powder.",
    "Add the lentils, tomato, coconut milk, and enough water to cover.",
    "Simmer for 25–30 minutes until the lentils are soft, seasoning with salt.",
    "Serve over rice."
  ]
}
