{
  "id": "pasta_e_ceci",
  "title": "Pasta e Ceci",
  "author": "Claude",
  "servings": 4,
  "image": "images/pasta_e_ceci.svg",
  "description": "Roman chickpea and pasta stew, half soup, half pasta. Rosemary, garlic and a little tomato.",
  "cuisine": "Italian",
  "tags": ["dinner", "pasta", "vegetarian", "comfort"],
  "prep_time": 10,
  "cook_time": 25,
  "ingredients": [
    { "ingredient": "short_pasta", "amount": 250, "note": "ditalini or small shells" },
    { "ingredient": "chickpeas", "amount": 2, "unit": "cans", "note": "drained" },
    { "ingredient": "onion", "amount": 1, "unit": "pcs", "note": "finely chopped" },
    { "ingredient": "garlic", "amount": 2, "unit": "cloves", "note": "crushed" },
    { "ingredient": "rosemary", "amount": 1, "unit": "sprig" },
    { "ingredient": "tomato_paste", "amount": 30 },
    { "ingredient": "vegetable_broth", "amount": 750 },
    { "ingredient": "olive_oil", "amount": 2, "unit": "tbsp" },
    { "ingredient": "parmesan", "amount": 40, "note": "grated", "optional": true },
    { "ingredient": "salt" },
    { "ingredient": "black_pepper" }
  ],
  "steps": [
    "Soften the onion in the olive oil for 5 minutes, then add the garlic, rosemary and tomato paste and fry for a minute.",
    "Add the chickpeas and broth and simmer for 10 minutes. Remove the rosemary and blend about a third of the pot to thicken it.",
    "Add the pasta and cook it in the stew, stirring often and adding water if it gets too thick.",
    "Season with salt and pepper and serve with olive oil and parmesan."
  ]
}
