{
  "id": "tomato_soup",
  "title": "Tomato Soup",
  "author": "Claude",
  "servings": 4,
  "image": "images/tomato_soup.svg",
  "description": "A simple, comforting tomato soup built on onion, garlic, and a splash of broth.",
  "cuisine": "American",
  "tags": ["soup", "vegetarian", "comfort"],
  "prep_time": 10,
  "cook_time": 30,
  "ingredients": [
    { "ingredient": "chopped_tomatoes", "amount": 2, "unit": "cans" },
    { "ingredient": "onion", "amount": 1, "unit": "pcs", "note": "diced" },
    { "ingredient": "garlic", "amount": 4, "unit": "cloves" },
    { "ingredient": "olive_oil", "amount": 2, "unit": "tbsp" },
    { "ingredient": "vegetable_broth", "amount": 500 },
    { "ingredient": "salt" },
    { "ingredient": "black_pepper" }
  ],
  "steps": [
    "Soften the chopped onion and garlic in olive oil.",
    "Add the tomatoes and broth; simmer for 25 minutes.",
    "Blend until smooth, then season with salt and pepper."
  ]
}
